<?xml version="1.0"?>


<xs:schema version="1.0"
           xmlns:xs="http://www.w3.org/2001/XMLSchema"
           elementFormDefault="qualified">
    
    <xs:element name="tobao">
        <xs:complexType>
            <xs:sequence>
                <xs:element name="baibao" minOccurs="2" maxOccurs="unbounded" >
                    <xs:complexType>
                        <xs:sequence>
                            <xs:element name="tieude">
                                <xs:simpleType>
                                    <xs:restriction base="xs:string">
                                        <xs:pattern value="[a-zA-Z0-9\s]{10,}"/>
                                    </xs:restriction>
                                </xs:simpleType>
                            </xs:element>
                            <xs:element name="noidung">
                                <xs:simpleType>
                                    <xs:restriction base="xs:string">
                                        <xs:pattern value="[a-zA-Z0-9\s]{20,}"/>
                                    </xs:restriction>
                                </xs:simpleType>
                            </xs:element>
                            <xs:element name="tacgia">
                                <xs:complexType>
                                    <xs:sequence>
                                        <xs:element name="hoten">
                                            <xs:simpleType>
                                                <xs:restriction base="xs:string">
                                                    <xs:pattern value="[a-zA-Z\s]+"/>
                                                </xs:restriction>
                                            </xs:simpleType>
                                        </xs:element>
                                        <xs:element name="tuoi">
                                            <xs:simpleType>
                                                <xs:restriction base="xs:int">
                                                    <xs:pattern value="\d+"/>
                                                </xs:restriction>
                                            </xs:simpleType>
                                        </xs:element>
                                        <xs:element name="email">
                                            <xs:simpleType>
                                                <xs:restriction base="xs:string">
                                                    <xs:pattern value="[a-z0-9]+@[a-z]+\.[a-z]+"/>
                                                </xs:restriction>
                                            </xs:simpleType>
                                        </xs:element>
                                    </xs:sequence>
                                </xs:complexType>
                            </xs:element> 
                            <xs:element name="ngaydang" type="xs:date"/> 
                            <xs:element name="loaibaibao">
                                <xs:simpleType>
                                    <xs:restriction base="xs:string">
                                        <xs:enumeration value="van hoa"/> 
                                        <xs:enumeration value="xa hoi"/> 
                                        <xs:enumeration value="giai tri"/> 
                                    </xs:restriction>
                                </xs:simpleType>
                            </xs:element>
                        </xs:sequence>
                        <xs:attribute name="mabaibao">
                            <xs:simpleType>
                                <xs:restriction base="xs:int">
                                    <xs:pattern value="\d+"/>
                                </xs:restriction>
                            </xs:simpleType>
                        </xs:attribute>
                    </xs:complexType>
                </xs:element>
                
            </xs:sequence>
        </xs:complexType>
    </xs:element>
           
</xs:schema>
